{
  "artifact_format": 1,
  "product": "omo-cloud",
  "schema_version": 4,
  "proto_tag": "v1.7.0",
  "identity": "none",
  "relay": false,
  "semconv_map_sha256": "2cf8b859a1fbad492a3ee51864f73762ea7263f34423d4965e7a557184d1f053",
  "resource": {
    "host.arch": {
      "type": "string",
      "values": [
        "amd64",
        "arm64",
        "x86",
        "arm32",
        "other"
      ],
      "required": true,
      "posthog_name": "arch"
    },
    "omo.ci": {
      "type": "boolean",
      "required": true,
      "posthog_name": "ci"
    },
    "omo.schema.version": {
      "type": "number",
      "integer": true,
      "min": 1,
      "max": 1000,
      "required": true,
      "posthog_name": "schema_version"
    },
    "omo.surface": {
      "type": "string",
      "values": [
        "cloud"
      ],
      "required": true,
      "posthog_name": "surface"
    },
    "os.type": {
      "type": "string",
      "values": [
        "darwin",
        "linux",
        "windows"
      ],
      "required": true,
      "posthog_name": "$os"
    },
    "os.version": {
      "type": "string",
      "pattern": "^[0-9]{1,6}(\\.[0-9]{1,6}){1,3}$",
      "required": false,
      "posthog_name": "$os_version"
    },
    "service.instance.id": {
      "type": "string",
      "pattern": "^[0-9a-f]{32}$",
      "required": true
    },
    "service.name": {
      "type": "string",
      "values": [
        "omo-cloud"
      ],
      "required": true,
      "posthog_name": "product"
    },
    "service.version": {
      "type": "string",
      "pattern": "^[0-9]{1,6}\\.[0-9]{1,6}\\.[0-9]{1,6}(-(alpha|beta|rc|dfa)\\.[0-9]{1,6}|-(nightly|preview)\\.[0-9]{8}\\.[0-9]{1,6}|-[0-9]{1,6})?$",
      "required": true,
      "posthog_name": "package_version"
    },
    "telemetry.sdk.language": {
      "type": "string",
      "values": [
        "nodejs"
      ],
      "required": true
    },
    "telemetry.sdk.name": {
      "type": "string",
      "values": [
        "opentelemetry",
        "omo-otel-minimal"
      ],
      "required": true
    },
    "telemetry.sdk.version": {
      "type": "string",
      "pattern": "^[0-9]{1,6}\\.[0-9]{1,6}\\.[0-9]{1,6}(-(alpha|beta|rc|dfa)\\.[0-9]{1,6}|-(nightly|preview)\\.[0-9]{8}\\.[0-9]{1,6}|-[0-9]{1,6})?$",
      "required": true
    }
  },
  "scope": {
    "name": [
      "omo-cloud"
    ],
    "version": "^[0-9]{1,6}\\.[0-9]{1,6}\\.[0-9]{1,6}(-(alpha|beta|rc|dfa)\\.[0-9]{1,6}|-(nightly|preview)\\.[0-9]{8}\\.[0-9]{1,6}|-[0-9]{1,6})?$"
  },
  "events": {
    "omo.category_config": {
      "log.record.uid": {
        "type": "string",
        "pattern": "^[0-9a-f]{8}-[0-9a-f]{4}-[0-9a-f]{4}-[0-9a-f]{4}-[0-9a-f]{12}$",
        "required": true,
        "posthog_name": "event_id"
      },
      "omo.builtin_overridden_count": {
        "type": "number",
        "min": 0,
        "max": 1000000000,
        "required": false,
        "posthog_name": "builtin_overridden_count"
      },
      "omo.cat_architect": {
        "type": "string",
        "values": [
          "qwen3.6-flash",
          "qwen3.8-max-preview",
          "claude-fable-5-5",
          "claude-fable-5",
          "claude-fable-5-1",
          "claude-haiku-4-5",
          "claude-haiku-5-5",
          "claude-opus-4-6",
          "claude-opus-5",
          "claude-opus-5-5",
          "claude-sonnet-5",
          "claude-sonnet-5-5",
          "qwen3.7-plus",
          "gpt-5.6-luna-fast",
          "gpt-5.6-sol",
          "gpt-5.6-sol-fast",
          "gpt-5.6-terra",
          "gpt-6-astra",
          "gpt-6-luna",
          "gpt-6-luna-fast",
          "gpt-6-sol",
          "gpt-6-sol-fast",
          "gpt-6.1-sol",
          "gpt-6.1-sol-fast",
          "deepseek-flash",
          "deepseek-v4-flash",
          "deepseek-v4-pro",
          "gemini-3.1-pro",
          "gemini-3.6-flash",
          "gemini-4-argon",
          "grok-4.6",
          "grok-4.7",
          "k3",
          "k3.1-pro",
          "k3.1-pro-highspeed",
          "kimi-for-coding-highspeed",
          "kimi-k3",
          "kimi-k3.1-pro",
          "kimi-k3.1-pro-highspeed",
          "glm-5.2",
          "glm-5.3",
          "mimo-v2.5-pro",
          "mimo-v2.6-pro",
          "minimax-m2.7",
          "minimax-m3",
          "grok-4.20-0309-non-reasoning",
          "mimo-v2.6-flash",
          "glm-5.3-flash",
          "custom"
        ],
        "required": false,
        "posthog_name": "cat_architect"
      },
      "omo.cat_artistry": {
        "type": "string",
        "values": [
          "qwen3.6-flash",
          "qwen3.8-max-preview",
          "claude-fable-5-5",
          "claude-fable-5",
          "claude-fable-5-1",
          "claude-haiku-4-5",
          "claude-haiku-5-5",
          "claude-opus-4-6",
          "claude-opus-5",
          "claude-opus-5-5",
          "claude-sonnet-5",
          "claude-sonnet-5-5",
          "qwen3.7-plus",
          "gpt-5.6-luna-fast",
          "gpt-5.6-sol",
          "gpt-5.6-sol-fast",
          "gpt-5.6-terra",
          "gpt-6-astra",
          "gpt-6-luna",
          "gpt-6-luna-fast",
          "gpt-6-sol",
          "gpt-6-sol-fast",
          "gpt-6.1-sol",
          "gpt-6.1-sol-fast",
          "deepseek-flash",
          "deepseek-v4-flash",
          "deepseek-v4-pro",
          "gemini-3.1-pro",
          "gemini-3.6-flash",
          "gemini-4-argon",
          "grok-4.6",
          "grok-4.7",
          "k3",
          "k3.1-pro",
          "k3.1-pro-highspeed",
          "kimi-for-coding-highspeed",
          "kimi-k3",
          "kimi-k3.1-pro",
          "kimi-k3.1-pro-highspeed",
          "glm-5.2",
          "glm-5.3",
          "mimo-v2.5-pro",
          "mimo-v2.6-pro",
          "minimax-m2.7",
          "minimax-m3",
          "grok-4.20-0309-non-reasoning",
          "mimo-v2.6-flash",
          "glm-5.3-flash",
          "custom"
        ],
        "required": false,
        "posthog_name": "cat_artistry"
      },
      "omo.cat_deep_high": {
        "type": "string",
        "values": [
          "qwen3.6-flash",
          "qwen3.8-max-preview",
          "claude-fable-5-5",
          "claude-fable-5",
          "claude-fable-5-1",
          "claude-haiku-4-5",
          "claude-haiku-5-5",
          "claude-opus-4-6",
          "claude-opus-5",
          "claude-opus-5-5",
          "claude-sonnet-5",
          "claude-sonnet-5-5",
          "qwen3.7-plus",
          "gpt-5.6-luna-fast",
          "gpt-5.6-sol",
          "gpt-5.6-sol-fast",
          "gpt-5.6-terra",
          "gpt-6-astra",
          "gpt-6-luna",
          "gpt-6-luna-fast",
          "gpt-6-sol",
          "gpt-6-sol-fast",
          "gpt-6.1-sol",
          "gpt-6.1-sol-fast",
          "deepseek-flash",
          "deepseek-v4-flash",
          "deepseek-v4-pro",
          "gemini-3.1-pro",
          "gemini-3.6-flash",
          "gemini-4-argon",
          "grok-4.6",
          "grok-4.7",
          "k3",
          "k3.1-pro",
          "k3.1-pro-highspeed",
          "kimi-for-coding-highspeed",
          "kimi-k3",
          "kimi-k3.1-pro",
          "kimi-k3.1-pro-highspeed",
          "glm-5.2",
          "glm-5.3",
          "mimo-v2.5-pro",
          "mimo-v2.6-pro",
          "minimax-m2.7",
          "minimax-m3",
          "grok-4.20-0309-non-reasoning",
          "mimo-v2.6-flash",
          "glm-5.3-flash",
          "custom"
        ],
        "required": false,
        "posthog_name": "cat_deep_high"
      },
      "omo.cat_deep_low": {
        "type": "string",
        "values": [
          "qwen3.6-flash",
          "qwen3.8-max-preview",
          "claude-fable-5-5",
          "claude-fable-5",
          "claude-fable-5-1",
          "claude-haiku-4-5",
          "claude-haiku-5-5",
          "claude-opus-4-6",
          "claude-opus-5",
          "claude-opus-5-5",
          "claude-sonnet-5",
          "claude-sonnet-5-5",
          "qwen3.7-plus",
          "gpt-5.6-luna-fast",
          "gpt-5.6-sol",
          "gpt-5.6-sol-fast",
          "gpt-5.6-terra",
          "gpt-6-astra",
          "gpt-6-luna",
          "gpt-6-luna-fast",
          "gpt-6-sol",
          "gpt-6-sol-fast",
          "gpt-6.1-sol",
          "gpt-6.1-sol-fast",
          "deepseek-flash",
          "deepseek-v4-flash",
          "deepseek-v4-pro",
          "gemini-3.1-pro",
          "gemini-3.6-flash",
          "gemini-4-argon",
          "grok-4.6",
          "grok-4.7",
          "k3",
          "k3.1-pro",
          "k3.1-pro-highspeed",
          "kimi-for-coding-highspeed",
          "kimi-k3",
          "kimi-k3.1-pro",
          "kimi-k3.1-pro-highspeed",
          "glm-5.2",
          "glm-5.3",
          "mimo-v2.5-pro",
          "mimo-v2.6-pro",
          "minimax-m2.7",
          "minimax-m3",
          "grok-4.20-0309-non-reasoning",
          "mimo-v2.6-flash",
          "glm-5.3-flash",
          "custom"
        ],
        "required": false,
        "posthog_name": "cat_deep_low"
      },
      "omo.cat_quick": {
        "type": "string",
        "values": [
          "qwen3.6-flash",
          "qwen3.8-max-preview",
          "claude-fable-5-5",
          "claude-fable-5",
          "claude-fable-5-1",
          "claude-haiku-4-5",
          "claude-haiku-5-5",
          "claude-opus-4-6",
          "claude-opus-5",
          "claude-opus-5-5",
          "claude-sonnet-5",
          "claude-sonnet-5-5",
          "qwen3.7-plus",
          "gpt-5.6-luna-fast",
          "gpt-5.6-sol",
          "gpt-5.6-sol-fast",
          "gpt-5.6-terra",
          "gpt-6-astra",
          "gpt-6-luna",
          "gpt-6-luna-fast",
          "gpt-6-sol",
          "gpt-6-sol-fast",
          "gpt-6.1-sol",
          "gpt-6.1-sol-fast",
          "deepseek-flash",
          "deepseek-v4-flash",
          "deepseek-v4-pro",
          "gemini-3.1-pro",
          "gemini-3.6-flash",
          "gemini-4-argon",
          "grok-4.6",
          "grok-4.7",
          "k3",